{"applicable_rules":[],"bundle_id":"bundle_research_kernel","certificate_ids":["cert_z3_repair_maxsmt"],"context_facts":[],"defeated_rules":[],"models":[],"source_span_ids":["span_contra_bl_allergy","span_rec_sepsis_bl"],"trace":[],"unsat_cores":[],"violated_constraints":[],"witness_id":"nf-a6604bde5a9f3ab5a4718b20b61f293f"}