{"applicable_rules":["rule_incomplete_provenance"],"bundle_id":"bundle_research_kernel","certificate_ids":["cert_shacl_rules"],"context_facts":[],"defeated_rules":[],"models":[],"source_span_ids":[],"trace":[],"unsat_cores":[],"violated_constraints":["rule_incomplete_provenance/provenance","rule_incomplete_provenance/source_span_ids"],"witness_id":"nf-59a57e17b06e49a72ce60b9ce5a6b474"}