{"applicable_rules":["rule_sepsis_bl_001"],"bundle_id":"bundle_sepsis_toy","case_id":"case_sepsis_allergy","certificate_ids":[],"context_facts":[{"fact":"dx_sepsis","value":true}],"defeated_rules":[],"models":[{"solver":"z3","status":"sat"}],"source_span_ids":["span_gl_s1"],"trace":[{"result":"applicable","rule":"rule_recommend","step":1}],"unsat_cores":[],"violated_constraints":[],"witness_id":"witness_conflict_001"}