[{"applicable_rules":["rule_sepsis_bl_recommend","rule_bl_anaphylaxis_contra"],"bundle_id":"bundle_toy_v0","case_id":"case_sepsis_allergy","certificate_ids":[],"context_facts":[{"active":true,"code":"sepsis","type":"diagnosis"},{"reaction":"anaphylaxis","substance":"beta_lactam","type":"allergy","verified":true},{"type":"age","unit":"years","value":68}],"defeated_rules":["rule_sepsis_bl_recommend"],"models":[{"assignments":{"adult_patient":true,"allergy_beta_lactam":true,"dx_sepsis":true,"shared_context_satisfiable":true},"solver":"z3","status":"sat"}],"source_span_ids":["span_rec_sepsis_bl","span_contra_bl_allergy","span_allergy_history"],"trace":[{"action":"evaluate_rule","result":"applicable","rule_id":"rule_sepsis_bl_recommend","step":1},{"action":"evaluate_rule","result":"applicable","rule_id":"rule_bl_anaphylaxis_contra","step":2},{"action":"detect_conflict","rules":["rule_sepsis_bl_recommend","rule_bl_anaphylaxis_contra"],"step":3,"type":"norm_contradiction"},{"action":"apply_priority","inferior":"rule_sepsis_bl_recommend","result":"defeated","step":4,"superior":"rule_bl_anaphylaxis_contra"}],"unsat_cores":[],"violated_constraints":["Norm contradiction: recommend-for and recommend-against for same action (administer beta_lactam) under shared satisfiable context"],"witness_id":"witness_norm_conflict"}]
