{"applicable_rules":[],"bundle_id":"bundle_research_kernel","certificate_ids":["cert_clingo_event_calculus"],"context_facts":[],"defeated_rules":[],"models":["holdsAt(allergy_known,10)","violation(conflict_ec_allergy_persistence)"],"source_span_ids":["span_allergy_history","span_contra_bl_allergy"],"trace":[],"unsat_cores":[],"violated_constraints":["conflict_ec_allergy_persistence"],"witness_id":"nf-bd369feba5135e447b283223023f6fa4"}