{"applicable_rules":[],"bundle_id":"bundle_research_kernel","certificate_ids":["cert_cvc5_norm_conflict"],"context_facts":[],"defeated_rules":[],"models":[],"source_span_ids":["span_allergy_history","span_contra_bl_allergy","span_evidence_sepsis","span_rec_sepsis_bl"],"trace":[],"unsat_cores":["recommend_administer_beta_lactam AND prohibit_administer_beta_lactam"],"violated_constraints":["recommend_administer_beta_lactam AND prohibit_administer_beta_lactam"],"witness_id":"nf-f394b47755c6de3296a46a48efd5c8b2"}