{"applicable_rules":[],"bundle_id":"bundle_research_kernel","certificate_ids":["cert_lean_norm_conflict"],"context_facts":[],"defeated_rules":[],"models":[],"source_span_ids":["span_allergy_history","span_contra_bl_allergy","span_evidence_sepsis","span_rec_sepsis_bl"],"trace":[],"unsat_cores":[],"violated_constraints":[],"witness_id":"nf-b42295c191f3f58419dc64a435c85eb8"}