{"applicable_rules":[],"bundle_id":"bundle_research_kernel","certificate_ids":["cert_tla_sany_conflict"],"context_facts":[],"defeated_rules":[],"models":[],"source_span_ids":["span_allergy_history","span_contra_bl_allergy"],"trace":[],"unsat_cores":[],"violated_constraints":[],"witness_id":"nf-a6cacca74bad30c4a58e483776427489"}