{"applicable_rules":[],"bundle_id":"bundle_research_kernel","certificate_ids":["cert_z3_decision_table"],"context_facts":[],"defeated_rules":[],"models":[],"source_span_ids":["span_cell_r0c0","span_cell_r0c1","span_cell_r1c0","span_cell_r1c1","span_cell_r2c0","span_cell_r2c1","span_cell_r3c0","span_cell_r3c1"],"trace":[],"unsat_cores":[],"violated_constraints":[],"witness_id":"nf-c4b368669f4edef17dcfad4e7251d84d"}