{"applicable_rules":["rule_bl_anaphylaxis_contra","rule_sepsis_bl_recommend"],"bundle_id":"bundle_research_kernel","certificate_ids":["cert_clingo_defeasible"],"context_facts":[],"defeated_rules":["rule_sepsis_bl_recommend"],"models":["defeated(rule_sepsis_bl_recommend)","defeated_arg(arg_rule_sepsis_bl_recommend)","in(arg_rule_bl_anaphylaxis_contra)"],"source_span_ids":["span_allergy_history","span_contra_bl_allergy","span_evidence_sepsis","span_rec_sepsis_bl"],"trace":[],"unsat_cores":[],"violated_constraints":[],"witness_id":"nf-5ab3298007d621828f32083593ca4f57"}