{"applicable_rules":[],"bundle_id":"bundle_research_kernel","certificate_ids":["cert_souffle_priority"],"context_facts":[],"defeated_rules":[],"models":[],"source_span_ids":["span_allergy_history","span_contra_bl_allergy","span_evidence_sepsis","span_rec_sepsis_bl"],"trace":[],"unsat_cores":[],"violated_constraints":[],"witness_id":"nf-d4487730e1a5b0413245970e14450657"}