{"applicable_rules":[],"bundle_id":"bundle_research_kernel","certificate_ids":["cert_alloy_priority"],"context_facts":[],"defeated_rules":[],"models":[],"source_span_ids":["span_allergy_history","span_contra_bl_allergy","span_evidence_sepsis","span_rec_sepsis_bl"],"trace":[],"unsat_cores":[],"violated_constraints":[],"witness_id":"nf-7c8df4ff74298670d779d151d950185b"}